{
 "topicId": "mt_-hTTat0mBR",
 "title": "What is a half?",
 "audience": "family",
 "keyIdea": "A half is one of two equal parts.",
 "explain": {
  "kid": [
   "Cut a cake into two parts that are the same size. Each part is a half.",
   "If one part is big and one is small, they are not halves."
  ],
  "adult": [
   "A half is one of two equal parts of a whole shape or a group. The key word is equal: two unequal pieces are not halves.",
   "Children meet halves first with shapes and food, then with groups: half of 8 sweets is 4, because 8 shared fairly between two is 4 each."
  ]
 },
 "familyTip": "Fold a piece of paper in half. Check the two parts match exactly. Then share 6 grapes into two fair halves.",
 "practice": [
  {
   "type": "mc",
   "id": "p1",
   "prompt": "A pizza is cut into 2 equal parts. Each part is…",
   "choices": [
    "a half",
    "a quarter",
    "a whole"
   ],
   "answer": 0,
   "hint": "Two equal parts.",
   "explain": "Two equal parts: each is a half."
  },
  {
   "type": "numeric",
   "id": "p2",
   "prompt": "What is half of {=2*n} sweets?",
   "answer": "n",
   "hint": "Share them into 2 fair piles.",
   "explain": "{=2*n} shared into 2 piles is {n} each.",
   "params": {
    "n": [
     2,
     6
    ]
   }
  },
  {
   "type": "mc",
   "id": "p3",
   "prompt": "A cake is cut into one big part and one small part. Are they halves?",
   "choices": [
    "No, they are not the same size",
    "Yes",
    "Only the big part"
   ],
   "answer": 0,
   "hint": "Halves must match.",
   "explain": "Halves are equal, so these are not halves."
  },
  {
   "type": "numeric",
   "id": "p4",
   "prompt": "Half of the {=2*n} cars are red. How many are red?",
   "answer": "n",
   "hint": "Share into 2 equal groups.",
   "explain": "{=2*n} ÷ 2 = {n}.",
   "params": {
    "n": [
     1,
     5
    ]
   }
  }
 ],
 "mastery": {
  "passMark": 3,
  "draw": 4,
  "pool": [
   {
    "type": "numeric",
    "id": "m1",
    "prompt": "What is half of {=2*n}?",
    "answer": "n",
    "hint": "Two equal groups.",
    "explain": "Half of {=2*n} is {n}.",
    "params": {
     "n": [
      1,
      8
     ]
    }
   },
   {
    "type": "mc",
    "id": "m2",
    "prompt": "How many halves make a whole?",
    "choices": [
     "2",
     "1",
     "4"
    ],
    "answer": 0,
    "hint": "Two parts.",
    "explain": "Two halves make one whole."
   },
   {
    "type": "numeric",
    "id": "m3",
    "prompt": "Sam eats half of {=2*n} grapes. How many does Sam eat?",
    "answer": "n",
    "hint": "Share fairly in two.",
    "explain": "{=2*n} ÷ 2 = {n} grapes.",
    "params": {
     "n": [
      2,
      7
     ]
    }
   },
   {
    "type": "mc",
    "id": "m4",
    "prompt": "Which shows a half?",
    "choices": [
     "A square cut into 2 same-size parts, one shaded",
     "A square cut into 3 parts, one shaded",
     "A square cut into 2 different parts, one shaded"
    ],
    "answer": 0,
    "hint": "Two equal parts.",
    "explain": "Only the first has two equal parts."
   },
   {
    "type": "mc",
    "id": "m5",
    "prompt": "Half an apple and half an apple make…",
    "choices": [
     "one whole apple",
     "a quarter",
     "two apples"
    ],
    "answer": 0,
    "hint": "2 halves.",
    "explain": "Two halves make a whole."
   },
   {
    "type": "mc",
    "id": "m6",
    "prompt": "Is half of 10 the same as 5?",
    "choices": [
     "Yes",
     "No"
    ],
    "answer": 0,
    "hint": "Share 10 in two.",
    "explain": "10 shared in two is 5 each."
   },
   {
    "type": "mc",
    "id": "m7",
    "prompt": "A sandwich is cut into 2 equal parts. You eat 1. What did you eat?",
    "choices": [
     "Half",
     "All of it",
     "A quarter"
    ],
    "answer": 0,
    "hint": "One of two equal parts.",
    "explain": "One of two equal parts is a half."
   }
  ]
 },
 "status": "self-checked",
 "visual": {
  "type": "fracbar",
  "caption": "Tap the parts. Shade one of the two equal parts: that is a half.",
  "opts": {
   "d": 2,
   "shade": 1,
   "pie": true
  }
 }
}
