{
 "topicId": "mt_6lHBTwQPrS",
 "title": "Question Words",
 "audience": "family",
 "keyIdea": "Question words tell you what kind of answer is wanted: who asks about a person, what about a thing, where about a place, when about a time, why for a reason (often with because) and how about the way something happens. A question ends with a question mark.",
 "explain": {
  "kid": [
   "Some words start a question. Who, what, where, when, why and how.",
   "Each word wants a different answer. Who wants a person. What wants a thing. Where wants a place.",
   "When wants a time. Why wants a reason. You often say because. How wants the way. By bus! On my bike!",
   "A question asks. It ends with a question mark. It looks like a hook: ?"
  ],
  "adult": [
   "The six wh-question words (who, what, where, when, why, how) each signal the type of information wanted: a person, a thing or action, a place, a time, a reason or a manner. Children who can match the word to the kind of answer understand stories and instructions better and can ask for exactly what they want to know. The US Common Core standard L.K.1d asks five-year-olds to understand and use these words, and the English national curriculum adds the question mark in Year 1.",
   "Who, what and where are usually understood first, and when, why and how later, because they deal with time, cause and manner, which are less concrete than people and places. Keep it concrete: ask about a picture, a book or what is happening now.",
   "Common mistakes: mixing up where and when, which sound alike, so a child answers a when question with a place; answering a why question with what happened instead of a reason; thinking any sentence that starts with a question word is a question, as in When it rains, I wear boots; and leaving off the question mark or using a full stop.",
   "At home, play a picture game. You ask one question with each word about a page of a book, and your child points or answers. Then swap: your child asks you, and you check together which word fits the answer you gave. Listen for because after why."
  ]
 },
 "familyTip": "Pick a picture in a book and take turns asking one who, what, where, when, why and how question about it. If an answer doesn't fit, ask \"Does that answer the word we used?\"",
 "practice": [
  {
   "type": "mc",
   "id": "p1",
   "prompt": "Which question word asks about a person?",
   "choices": [
    "Who",
    "Where",
    "When"
   ],
   "answer": 0,
   "hint": "In the park picture, which word lit up Mia and Sam?",
   "explain": "Who asks about a person: Who is kicking the ball? Mia is."
  },
  {
   "type": "mc",
   "id": "p2",
   "prompt": "The answer is \"At {n} o'clock.\" Which word started the question?",
   "choices": [
    "When",
    "Where",
    "Who"
   ],
   "answer": 0,
   "hint": "Is {n} o'clock a person, a place or a time?",
   "explain": "{n} o'clock is a time, so the question started with When.",
   "params": {
    "n": [
     1,
     12
    ]
   }
  },
  {
   "type": "mc",
   "id": "p3",
   "prompt": "\"Why is Leo crying?\" Which is the best answer?",
   "choices": [
    "Because he fell over.",
    "In the playground.",
    "At playtime."
   ],
   "answer": 0,
   "hint": "Why wants a reason. Which answer starts with because?",
   "explain": "Why asks for a reason: because he fell over. In the playground answers Where, and at playtime answers When."
  },
  {
   "type": "mc",
   "id": "p4",
   "prompt": "Ella has {n} toy cars. She asks Dad about the red one. Which question ends with a question mark?",
   "choices": [
    "Where is my red car?",
    "My red car is under the bed",
    "I like my red car"
   ],
   "answer": 0,
   "hint": "Which one asks something and wants an answer?",
   "explain": "Where is my red car? asks something, so it ends with a question mark. The other two tell, so they would end with a full stop.",
   "params": {
    "n": [
     3,
     9
    ]
   }
  }
 ],
 "mastery": {
  "passMark": 3,
  "draw": 4,
  "pool": [
   {
    "type": "mc",
    "id": "m1",
    "prompt": "Which question word asks about a place?",
    "choices": [
     "Where",
     "When",
     "Why"
    ],
    "answer": 0,
    "hint": "Where and when sound alike. Which one is about a place?",
    "explain": "Where asks about a place: Where is the dog? Under the tree."
   },
   {
    "type": "mc",
    "id": "m2",
    "prompt": "The answer is \"By bus.\" Which word started the question?",
    "choices": [
     "How",
     "Who",
     "When"
    ],
    "answer": 0,
    "hint": "By bus tells you the way something happens.",
    "explain": "By bus is the way, so the question was How: How did you get to school?"
   },
   {
    "type": "mc",
    "id": "m3",
    "prompt": "The answer is \"Grandma.\" Which question fits?",
    "choices": [
     "Who is coming to tea?",
     "What is for tea?",
     "When is tea?"
    ],
    "answer": 0,
    "hint": "Grandma is a person. Which word asks about a person?",
    "explain": "Grandma is a person, so the question starts with Who."
   },
   {
    "type": "mc",
    "id": "m4",
    "prompt": "Which sentence is a question?",
    "choices": [
     "Who ate the cake?",
     "When it rains, I wear boots.",
     "Tom ate the cake."
    ],
    "answer": 0,
    "hint": "A question asks something. Starting with when is not enough.",
    "explain": "Who ate the cake? asks something. When it rains, I wear boots starts with when but tells you something."
   },
   {
    "type": "mc",
    "id": "m5",
    "prompt": "Max has {n} stickers. Mum asks, \"What is on your stickers?\" Which answer fits?",
    "choices": [
     "Dinosaurs.",
     "In my bag.",
     "Yesterday."
    ],
    "answer": 0,
    "hint": "What asks about a thing. Which answer is a thing?",
    "explain": "What wants a thing, so dinosaurs fits. In my bag answers Where and yesterday answers When.",
    "params": {
     "n": [
      4,
      20
     ]
    }
   },
   {
    "type": "mc",
    "id": "m6",
    "prompt": "Kim is {n}. She wants to know how old Jo is and writes \"How old are you\". What goes at the end?",
    "choices": [
     "a question mark",
     "a full stop",
     "nothing"
    ],
    "answer": 0,
    "hint": "Does it ask, or does it tell?",
    "explain": "Kim is {n} and is asking Jo something, so \"How old are you?\" needs a question mark.",
    "params": {
     "n": [
      5,
      8
     ]
    }
   },
   {
    "type": "mc",
    "id": "m7",
    "prompt": "\"When is your party?\" Which is the best answer?",
    "choices": [
     "On Saturday.",
     "At my house.",
     "Because I am six."
    ],
    "answer": 0,
    "hint": "When wants a time. Which answer is a time?",
    "explain": "When asks about a time, so on Saturday fits. At my house answers Where; because I am six answers Why."
   },
   {
    "type": "mc",
    "id": "m8",
    "prompt": "Which word often starts the answer to a why question?",
    "choices": [
     "because",
     "under",
     "at"
    ],
    "answer": 0,
    "hint": "Why asks for a reason. Which word gives a reason?",
    "explain": "A why question wants a reason, and reasons often start with because."
   }
  ]
 },
 "status": "self-checked",
 "visual": {
  "type": "sorter",
  "caption": "Does this answer tell you a place or a time? Drag each card, or tap it and then tap a box.",
  "opts": {
   "bins": [
    "A place: answers Where",
    "A time: answers When"
   ],
   "items": [
    [
     "In the garden",
     0
    ],
    [
     "Under the bed",
     0
    ],
    [
     "At the park",
     0
    ],
    [
     "At bedtime",
     1
    ],
    [
     "On Monday",
     1
    ],
    [
     "After lunch",
     1
    ]
   ]
  }
 },
 "lab": {
  "type": "flagqw",
  "caption": "Flagship lab: see what each question word asks about, answer questions about a park picture, pick the word for an answer, and end sentences with ? or .",
  "opts": {
   "step": 0
  }
 }
}
